{
  "lastUpdated": "2026-04-14",
  "week": "2026-W16",
  "seo": {
    "googleIndexedPages": 19,
    "avgPosition": 42.3,
    "totalImpressions": 1240,
    "totalClicks": 87,
    "ctr": 7.0,
    "sitemapUrls": 19,
    "robotsTxtValid": true
  },
  "geo": {
    "perplexityCitations": 3,
    "chatgptMentions": 1,
    "bingCopilotMentions": 0,
    "llmsTxtCrawls": 12,
    "llmsFullTxtCrawls": 8,
    "aiOverviewAppearances": 2
  },
  "aeo": {
    "feedXmlValid": true,
    "structuredDataPages": 3,
    "faqSchemaPages": 0,
    "articleSchemaPages": 0,
    "avgAnswerBoxEligibility": "low"
  },
  "content": {
    "totalArticles": 17,
    "categoryCoverage": {
      "AI": 3,
      "Security": 3,
      "Tech": 4,
      "Freediving": 3,
      "Crypto": 1,
      "Sustainability": 1,
      "Economy": 1,
      "Robotics": 1
    },
    "avgReadTime": "10 min",
    "publishingCadence": "3-4 per week"
  },
  "history": [
    {
      "week": "2026-W14",
      "googleIndexedPages": 15,
      "totalImpressions": 820,
      "totalClicks": 51,
      "perplexityCitations": 1,
      "chatgptMentions": 0,
      "totalArticles": 14
    },
    {
      "week": "2026-W15",
      "googleIndexedPages": 17,
      "totalImpressions": 1050,
      "totalClicks": 68,
      "perplexityCitations": 2,
      "chatgptMentions": 1,
      "totalArticles": 16
    },
    {
      "week": "2026-W16",
      "googleIndexedPages": 19,
      "totalImpressions": 1240,
      "totalClicks": 87,
      "perplexityCitations": 3,
      "chatgptMentions": 1,
      "totalArticles": 17
    }
  ]
}